/Users/ashutosh

192:~ ashutosh$ mysql -u root -p
Enter password:

Welcome to the MySQL monitor.  Commands end with ; or \g.
Your MySQL connection id is 11

Server version: 8.0.22 MySQL Community Server - GPL

Copyright (c) 2000, 2020, Oracle and/or its affiliates. All rights reserved.

Oracle is a registered trademark of Oracle Corporation and/or its
affiliates. Other names may be trademarks of their respective
owners.

Type 'help;' or '\h' for help. Type '\c' to clear the current input statement.
mysql> show databases;

+                               +

| Database          |

+                               +

| information_schema |

| mysql             |

| performance_schema |

| sys               |

+                               +
4 rows in set (0.02 sec)

mysql> CREATE DATABASE payroll_service;
Query OK, 1 row affected (0.00 sec)

mysql> show databases;

+                               +

| Database          |

+                               +

| information_schema |

| mysql             |

| payroll_service    |

| performance_schema |

| sys               |

+                               +
5 rows in set (0.00 sec)


mysql> USE payroll_service;

Database changed

mysql> SELECT DATABASE();

+                          +

| DATABASE()      |

+                          +

| payroll_service |

+                          +

1 row in set (0.00 sec)

mysql> CREATE TABLE employee_payroll( id INT unsigned NOT NULL
AUTO_INCREMENT, name VARCHAR(150) NOT NULL, salary Double NOT NULL,
start              DATE NOT NULL, PRIMARY

KEY (id) );

ERROR 1050 (42S01): Table 'employee_payroll' already exists
mysql> SELECT * from employee_payroll;

Empty set (0.00 sec)

mysql> INSERT INTO employee_payroll (name, salary, start) VALUES
('Bill',1000000.00,'2018-01-03'), ('Mark',2000000.00,'2019-11-13'),
('Charlie',3000000.00,'2020-05-21' );

Query OK, 3 rows affected (0.00 sec)
Records: 3  Duplicates: 0  Warnings: 0

mysql> describe employee_payroll;

+            +                      +         +        +              +         
                +

| Field  | Type        | Null | Key | Default | Extra         |

+            +                      +         +        +              +         
                +

| id     | int unsigned | NO   | PRI | NULL    | auto_increment |

| name   | varchar(150) | NO   |     | NULL    |               |

| salary | double      | NO   |     | NULL    |               |

| start  | date        | NO   |     | NULL    |               |

+            +                      +         +        +              +         
                +
4 rows in set (0.00 sec)

mysql> select * from employee_payroll;

+      +              +              +                   +

| id | name    | salary  | start      |

+      +              +              +                   +

|  1 | Bill    | 1000000 | 2018-01-03 |

|  2 | Mark    | 2000000 | 2019-11-13 |

|  3 | Charlie | 3000000 | 2020-05-21 |

+      +              +              +                   +
3 rows in set (0.00 sec)

mysql> select salary from employee_payroll where name = 'Bill';


+              +

| salary  |

+              +

| 1000000 |

+              +

1 row in set (0.00 sec)

mysql> select * from employee_payroll where start between cast('2019-01-01'
as date) and date (now());

+      +              +              +                   +

| id | name    | salary  | start      |

+      +              +              +                   +

|  2 | Mark    | 2000000 | 2019-11-13 |

|  3 | Charlie | 3000000 | 2020-05-21 |

+      +              +              +                   +
2 rows in set (0.00 sec)

mysql> alter table employee_payroll add gender char(1) after name;
Query OK, 0 rows affected (0.03 sec)

Records: 0  Duplicates: 0  Warnings: 0

mysql> select * from employee_payroll;

+      +              +            +              +                   +

| id | name    | gender | salary  | start      |

+      +              +            +              +                   +

|  1 | Bill    | NULL   | 1000000 | 2018-01-03 |

|  2 | Mark    | NULL   | 2000000 | 2019-11-13 |

|  3 | Charlie | NULL   | 3000000 | 2020-05-21 |

+      +              +            +              +                   +
3 rows in set (0.00 sec)

mysql> update employee_payroll set gender = 'M' ;
Query OK, 3 rows affected (0.01 sec)

Rows matched: 3  Changed: 3  Warnings: 0

mysql> select * from employee_payroll;

+      +              +            +              +                   +

| id | name    | gender | salary  | start      |

+      +              +            +              +                   +

|  1 | Bill    | M      | 1000000 | 2018-01-03 |

|  2 | Mark    | M      | 2000000 | 2019-11-13 |

|  3 | Charlie | M      | 3000000 | 2020-05-21 |

+      +              +            +              +                   +
3 rows in set (0.00 sec)

mysql> update employee_payroll set name = 'Terisa' where name = 'Mark';


Query OK, 1 row affected (0.00 sec)

Rows matched: 1  Changed: 1  Warnings: 0

mysql> select * from employee_payroll;

+      +              +            +              +                   +

| id | name    | gender | salary  | start      |

+      +              +            +              +                   +

|  1 | Bill    | M      | 1000000 | 2018-01-03 |

|  2 | Terisa  | M      | 2000000 | 2019-11-13 |

|  3 | Charlie | M      | 3000000 | 2020-05-21 |

+      +              +            +              +                   +
3 rows in set (0.00 sec)

mysql> update employee_payroll set gender = 'F' where name = 'Terisa';
Query OK, 1 row affected (0.00 sec)

Rows matched: 1  Changed: 1  Warnings: 0

mysql> select * from employee_payroll;

+      +              +            +              +                   +

| id | name    | gender | salary  | start      |

+      +              +            +              +                   +

|  1 | Bill    | M      | 1000000 | 2018-01-03 |

|  2 | Terisa  | F      | 2000000 | 2019-11-13 |

|  3 | Charlie | M      | 3000000 | 2020-05-21 |

+      +              +            +              +                   +
3 rows in set (0.00 sec)

mysql> update employee_payroll set salary = '3000000.00' where name =
'Terisa';

Query OK, 1 row affected (0.01 sec)

Rows matched: 1  Changed: 1  Warnings: 0

mysql> select * from employee_payroll;

+      +              +            +              +                   +

| id | name    | gender | salary  | start      |

+      +              +            +              +                   +

|  1 | Bill    | M      | 1000000 | 2018-01-03 |

|  2 | Terisa  | F      | 3000000 | 2019-11-13 |

|  3 | Charlie | M      | 3000000 | 2020-05-21 |

+      +              +            +              +                   +
3 rows in set (0.00 sec)

mysql> select avg(salary) from employee_payroll where gender = 'M' group by
gender;

+                    +

| avg(salary) |


+                    +

|     2000000 |

+                    +

1 row in set (0.00 sec)

mysql> select avg(salary) from employee_payroll group by gender;

+                    +

| avg(salary) |

+                    +

|     2000000 |

|     3000000 |

+                    +

2 rows in set (0.00 sec)

mysql> select gender, count(name) from employee_payroll group by gender;

+            +                    +

| gender | count(name) |

+            +                    +

| M      |          2 |

| F      |          1 |

+            +                    +
2 rows in set (0.00 sec)

mysql> select gender, sum(salary) from employee_payroll group by gender;

+            +                    +

| gender | sum(salary) |

+            +                    +

| M      |     4000000 |

| F      |     3000000 |

+            +                    +
2 rows in set (0.00 sec)

mysql> select * from employee_payroll;

+      +              +            +              +                   +

| id | name    | gender | salary  | start      |

+      +              +            +              +                   +

|  1 | Bill    | M      | 1000000 | 2018-01-03 |

|  2 | Terisa  | F      | 3000000 | 2019-11-13 |

|  3 | Charlie | M      | 3000000 | 2020-05-21 |

+      +              +            +              +                   +
3 rows in set (0.00 sec)

